ham	THANX 4 PUTTIN DA FONE DOWN ON ME!!
ham	No da if you run that it activate the full version da.
com	there are some napkins on the kitchen table can you bring them here
ham	Cbe is really good nowadays:)lot of shop and showrooms:)city is shaping good.
ham	Babe, have you got enough money to pick up bread and milk ? And I'll give you it back when you get home ?
ham	Unni thank you dear for the recharge..Rakhesh
ham	I'm in town now so i'll jus take mrt down later.
com	there are some napkins on the kitchen table can you bring them here
ham	Okay but i thought you were the expert
ham	Do you like shaking your booty on the dance floor?
ham	At home by the way
ham	I'll reach in ard 20 mins ok...
ham	LOL that would be awesome payback.
ham	Just got outta class gonna go gym.
ham	What you need. You have a person to give na.
ham	there are some plastic bags in the kitchen drawer can you take one and bring it here
ham	For me the love should start with attraction.i should feel that I need her every time around me.she should be the first thing which comes in my thoughts.I would start the day and end it with her.she should be there every time I dream.love will be then when my every breath has her name.my life should happen around her.my life will be named to her.I would cry for her.will give all my happiness and take all her sorrows.I will be ready to fight with anyone for her.I will be in love when I will be doing the craziest things for her.love will be when I don't have to proove anyone that my girl is the most beautiful lady on the whole planet.I will always be singing praises for her.love will be when I start up making chicken curry and end up makiing sambar.life will be the most beautiful then.will get every morning and thank god for the day because she is with me.I would like to say a lot..will tell later..
ham	Water logging in desert. Geoenvironmental implications.
ham	Sorry completely forgot * will pop em round this week if your still here?
ham	What does the dance river do?
com	can you go to the kitchen find a glass and bring it to me
ham	I wasn't well babe, i have swollen glands at my throat ... What did you end up doing ?
ham	S.i'm watching it in live..
ham	there 's a yellow jacket in the dining room can you bring it to me 
ham	In e msg jus now. U said thanks for gift.
ham	Mm not entirely sure i understood that text but hey. Ho. Which weekend?
ham	HI BABE U R MOST LIKELY TO BE IN BED BUT IM SO SORRY ABOUT TONIGHT! I REALLY WANNA SEE U TOMORROW SO CALL ME AT 9. LOVE ME XXX
ham	Wife.how she knew the time of murder exactly
ham	I AM AT THE GAS STATION. GO THERE.
ham	U know we watchin at lido?
ham	I cant pick the phone right now. Pls send a message
ham	No message..no responce..what happend?
ham	I have lost 10 kilos as of today!
ham	I can ask around but there's not a lot in terms of mids up here
ham	Yupz... I've oredi booked slots 4 my weekends liao... 
ham	I like to talk pa but am not able to. I dont know y.
ham	I guess it is useless calling u 4 something important.
com	can you find a red t-shirt in the dresser
ham	Huh so early.. Then ü having dinner outside izzit?
ham	Gain the rights of a wife.dont demand it.i am trying as husband too.Lets see
ham	Well, i'm glad you didn't find it totally disagreeable ... Lol
ham	Stupid auto correct on my phone
com	can you bring the mayo over here
com	can you bring the glass to the sink
ham	Whenevr ur sad, Whenevr ur gray, Remembr im here 2 listn 2 watevr u wanna say, Jus walk wid me a little while,&amp; I promise I'll bring back ur smile.:-)
com	you should bring me the brown envelope that is on the table
ham	Fine i miss you very much.
ham	Ok but knackered. Just came home and went to sleep! Not good at this full time work lark.
ham	soon you will have the real thing princess! Do i make you wet? :)
ham	Done it but internet connection v slow and can‘t send it. Will try again later or first thing tomo.
ham	So there's a ring that comes with the guys costumes. It's there so they can gift their future yowifes. Hint hint
ham	Its sunny in california. The weather's just cool
com	take my jacket from the jacket hook in my bedroom
ham	The world is running and i am still.maybe all are feeling the same,so be it.or i have to admit,i am mad.then where is the correction?or let me call this is life.and keep running with the world,may be u r also running.lets run.
ham	Good morning princess! Have a great day!
ham	I dont have any of your file in my bag..i was in work when you called me.i 'll tell you if i find anything in my room.
ham	Sorry, left phone upstairs. OK, might be hectic but would be all my birds with one fell swoop. It's a date.
ham	She's borderline but yeah whatever.
ham	Derp. Which is worse, a dude who always wants to party or a dude who files a complaint about the three drug abusers he lives with
ham	I don't run away frm u... I walk slowly &amp; it kills me that u don't care enough to stop me...
com	Send me your resume:-)
ham	I had askd u a question some hours before. Its answer
ham	Yo my trip got postponed, you still stocked up?
ham	The basket's gettin full so I might be by tonight
ham	What will we do in the shower, baby?
ham	Lol they don't know about my awesome phone. I could click delete right now if I want.
ham	Thanks da thangam, i feel very very happy dear. I also miss you da.
ham	Ok i go change also...
ham	Unless it's a situation where YOU GO GURL would be more appropriate
ham	hiya hows it going in sunny africa? hope u r avin a good time. give that big old silver back a big kiss from me.
ham	Nobody names their penis a girls name this story doesn't add up at all
ham	That's my honeymoon outfit. :)
ham	I thought slide is enough.
ham	No shit, but I wasn't that surprised, so I went and spent the evening with that french guy I met in town here and we fooled around a bit but I didn't let him fuck me
ham	Multiply the numbers independently and count decimal points then, for the division, push the decimal places like i showed you.
ham	Yeah, I'll leave in a couple minutes &amp; let you know when I get to mu
ham	How's my loverboy doing ? What does he do that keeps him from coming to his Queen, hmmm ? Doesn't he ache to speak to me ? Miss me desparately ?
ham	Sir, I am waiting for your mail.
ham	No let me do the math. Your not good at it.
ham	You in your room? I need a few
ham	Mm i am on the way to railway
ham	Is that seriously how you spell his name?
ham	I'm also came to room.
com	go to the dining room
ham	Aight, can you text me the address?
com	can you bring me my eyeglass you can find it on the table in the dining room
ham	Well I might not come then...
com	bring the toilet paper to the bathroom
com	bring me the bottle
ham	What should i eat fo lunch senor
com	go to the lounge
com	bring the fruit onto the dining table
ham	K, can I pick up another 8th when you're done?
ham	Pls help me tell sura that i'm expecting a battery from hont. And that if should pls send me a message about how to download movies. Thanks
ham	Just got part Nottingham - 3 hrs 63miles. Good thing i love my man so much, but only doing 40mph. Hey ho
com	can you bring me my tablet
ham	Ok give me 5 minutes I think I see her. BTW you're my alibi. You were cutting my hair the whole time.
ham	I dont know ask to my brother. Nothing problem some thing that. Just i told .
com	bring the beers here and put them on the table next to the couch
com	bring me the cookie jar
ham	Sorry, I'll call later
ham	Ya it came a while ago
ham	Anything lor... you decide...
ham	I hope your alright babe? I worry that you might have felt a bit desparate when you learned the job was a fake ? I am here waiting when you come back, my love
com	bring me the cereals and the milk
ham	Why she wants to talk to me
com	bring me the glasses
com	please move to the side
ham	Sounds like a plan! Cardiff is still here and still cold! I'm sitting on the radiator!
com	please clean the room
ham	U can call now...
ham	What time is your flight time?
ham	Good afternoon, my love. How goes your day ? What are you up to ? I woke early and am online waiting for you ... Hmmm ... Italian boy is online I see . *grins*
ham	Hi:)did you asked to waheeda fathima about leave?
com	can you move a little bit to the right
ham	Lol your right. What diet? Everyday I cheat anyway. I'm meant to be a fatty :(
ham	New Theory: Argument wins d SITUATION, but loses the PERSON. So dont argue with ur friends just.. . . . kick them; say, I'm always correct.!
ham	Ok. But i finish at 6.
ham	Uncle G, just checking up on you. Do have a rewarding month
ham	Huh i cant thk of more oredi how many pages do we have?
ham	Idk. You keep saying that you're not, but since he moved, we keep butting heads over freedom vs. responsibility. And i'm tired. I have so much other shit to deal with that i'm barely keeping myself together once this gets added to it.
ham	I can. But it will tell quite long, cos i haven't finish my film yet...
ham	I will be outside office take all from there
ham	Pls i wont belive god.not only jesus.
ham	Thank you. do you generally date the brothas?
com	I need some water, could you bring some to me?
com	I need some paper, could you bring some to me?
com	please bring some paper
